{
  "$schema": "https://json-schema.org/draft/2020-12/schema",
  "$id": "architecture-report.schema.json",
  "title": "Architecture Report",
  "type": "object",
  "required": [
    "schema_version",
    "task_id",
    "agent",
    "status",
    "summary",
    "files_changed",
    "impacts",
    "decisions",
    "risks",
    "blockers",
    "notes_for_next_agent"
  ],
  "properties": {
    "schema_version": {
      "type": "string",
      "const": "1.0"
    },
    "task_id": {
      "type": "string"
    },
    "agent": {
      "type": "string"
    },
    "status": {
      "type": "string",
      "enum": [
        "COMPLETE",
        "PARTIAL",
        "BLOCKED",
        "CHANGES_REQUIRED"
      ]
    },
    "summary": {
      "type": "string"
    },
    "files_changed": {
      "type": "array",
      "items": {
        "type": "string"
      }
    },
    "impacts": {
      "type": "object",
      "required": [
        "database",
        "backend",
        "frontend",
        "infrastructure",
        "testing",
        "contract_change"
      ],
      "properties": {
        "database": {
          "type": [
            "boolean",
            "null"
          ]
        },
        "backend": {
          "type": [
            "boolean",
            "null"
          ]
        },
        "frontend": {
          "type": [
            "boolean",
            "null"
          ]
        },
        "infrastructure": {
          "type": [
            "boolean",
            "null"
          ]
        },
        "testing": {
          "type": [
            "boolean",
            "null"
          ]
        },
        "contract_change": {
          "type": [
            "boolean",
            "null"
          ]
        }
      },
      "additionalProperties": false
    },
    "decisions": {
      "type": "array",
      "items": {
        "type": "string"
      }
    },
    "risks": {
      "type": "array",
      "items": {
        "type": "object",
        "required": [
          "severity",
          "description",
          "mitigation"
        ],
        "properties": {
          "severity": {
            "type": "string",
            "enum": [
              "low",
              "medium",
              "high",
              "critical"
            ]
          },
          "description": {
            "type": "string"
          },
          "mitigation": {
            "type": "string"
          }
        },
        "additionalProperties": false
      }
    },
    "blockers": {
      "type": "array",
      "items": {
        "type": "object",
        "required": [
          "type",
          "description"
        ],
        "properties": {
          "type": {
            "type": "string"
          },
          "description": {
            "type": "string"
          },
          "suggestion": {
            "type": "string"
          }
        },
        "additionalProperties": false
      }
    },
    "notes_for_next_agent": {
      "type": "array",
      "items": {
        "type": "string"
      }
    }
  },
  "additionalProperties": false
}
